{
  "schema_version": "1",
  "orchestration": {
    "orchestrator_schema_version": "0.1.0",
    "bounds_fingerprint": "5ab1c0de9f7a3b21"
  },
  "compatibility": {
    "comparison_schema_version": "0.1.0",
    "active_policy_id": "intent-routing",
    "active_policy_version": "1.0.0",
    "active_config_fingerprint": "cfg-9f2a",
    "active_runtime_profile": "default",
    "active_dataset_id": null,
    "shadow_policy_id": "semantic-reuse-proposal",
    "shadow_policy_version": "0.3.0",
    "shadow_config_fingerprint": "cfg-9f2a",
    "shadow_runtime_profile": "default",
    "shadow_dataset_id": null
  },
  "total_comparisons": 12,
  "comparable_comparisons": 12,
  "diverged_comparisons": 10,
  "category_counts": {
    "same_route_same_target": 2,
    "same_route_different_target": 0,
    "route_transition": 8,
    "response_vs_silent": 0,
    "fallback_vs_success": 2,
    "fallback_reason_mismatch": 0,
    "shadow_unusable": 0,
    "target_incomparable": 0
  },
  "metrics": {
    "shadow.divergence.fallback_reason_mismatch_count": { "value": 0, "sample_count": 12 },
    "shadow.divergence.fallback_vs_success_count": { "value": 2, "sample_count": 12 },
    "shadow.divergence.rate_pct": { "value": 83.33333333333333, "sample_count": 12 },
    "shadow.divergence.response_vs_silent_count": { "value": 0, "sample_count": 12 },
    "shadow.divergence.route_transition_count": { "value": 8, "sample_count": 12 },
    "shadow.divergence.same_route_different_target_count": { "value": 0, "sample_count": 12 },
    "shadow.divergence.same_route_same_target_count": { "value": 2, "sample_count": 12 },
    "shadow.divergence.shadow_unusable_count": { "value": 0, "sample_count": 12 },
    "shadow.divergence.target_incomparable_count": { "value": 0, "sample_count": 12 }
  },
  "divergent_cases": [
    {
      "event_id": "evt-3001",
      "correlation_id": "corr-3001",
      "category": "route_transition",
      "active_route": "template",
      "shadow_route": "generated",
      "active_fallback_reason": null,
      "shadow_fallback_reason": null
    },
    {
      "event_id": "evt-3002",
      "correlation_id": "corr-3002",
      "category": "fallback_vs_success",
      "active_route": "generated",
      "shadow_route": "generated",
      "active_fallback_reason": null,
      "shadow_fallback_reason": "unavailable"
    }
  ],
  "divergent_cases_truncated": true
}